group_id,post_count,post_ids,rep_title,combined_text,sample_titles,top_url,total_upvotes,total_comments,avg_pain_score,max_pain_score,avg_engagement,avg_buying_intent,avg_buildability,avg_sentiment,top_subreddits,top_signals,total_engagement,pain_norm,eng_norm,intent_norm,build_norm,valid_norm,sent_norm,final_score
116,1,1spj9jo,Django migrations were blocking our writes on 50M+ row tables — so I built a schema sync tool that skips them entirely,"- Django migrations were blocking our writes on 50M+ row tables — so I built a schema sync tool that skips them entirely

Best post body:
At work we run Django on MySQL at \900 req/s, and Django migrations became a real pain point: ALTER TABLE on large tables acquires full locks — we've had deploys block writes for minutes Migration history gets messy across environments No easy way to preview what DDL will actually run before committing to it Rolling back a bad migration on a 50M+ row table isn't fun So I wrote a \400 line Python script that diffs your Django models against the live DB schema using INFORMATION\SCHEMA and generates only the minimal ALTER TABLE statements needed. No migration files, no migration history table, no makemigrations/migrate dance. What it does: Compares every model field against the actual DB columns (type, nullability) Adds missing columns, drops removed ones, modifies changed types Handles GeneratedField (MySQL virtual/stored columns) Drops FK constraints before modifying dependent columns (avoids MySQL errors) Syncs indexes: db\index, unique, Meta.indexes, unique\together Dry-run mode (--dry-run) to preview the exact SQL before touching anything Skip list for apps you manage manually (Wagtail, CMS, etc.) What it doesn't do (intentionally): No data migrations — schema-only No migration history tracking — it's idempotent, run it anytime No Postgres/SQLite support — MySQL-specific INFORMATION\SCHEMA queries No rename detection — a rename looks like a drop + add Example dry-run output: ALTER TABLE users\profile ADD COLUMN last\active DATETIME NULL; ALTER TABLE orders DROP COLUMN legacy\status; ALTER TABLE products MODIFY COLUMN price DECIMAL(12,2) NOT NULL; [ Would love feedback — especially if you've dealt with similar migration pain at scale. Is this something others would find useful as a pip-installable package?",Django migrations were blocking our writes on 50M+ row tables — so I built a schema sync tool that skips them entirely,https://reddit.com/r/django/comments/1spj9jo/django_migrations_were_blocking_our_writes_on_50m/,0,23,12.0,12.0,12.4,0.0,52.0,0.078,django(1),manually,23,0.25,0.6558,0.0,0.8254,0.5,0.0,39.2
125,1,1sy03hi,PSA: Don’t trust your proposal automation to catch every mandatory requirement.,"- PSA: Don’t trust your proposal automation to catch every mandatory requirement.

Best post body:
We almost missed a mandatory set aside because our software categorized it as informational. Just a heads up to anyone else using AI for bid qualifying the phrasing can trip them up.",PSA: Don’t trust your proposal automation to catch every mandatory requirement.,https://reddit.com/r/projectmanagement/comments/1sy03hi/psa_dont_trust_your_proposal_automation_to_catch/,7,14,12.0,12.0,19.4,0.0,52.0,0.105,projectmanagement(1),manually,21,0.25,0.6378,0.0,0.8254,0.5,0.0,38.9
40,1,1szcrz8,An error occurred in the Server Components render. The specific message is omitted in production builds to avoid leaking sensitive details. A digest property is included on this error instance which may provide additional details about the nature of the error.,"- An error occurred in the Server Components render. The specific message is omitted in production builds to avoid leaking sensitive details. A digest property is included on this error instance which may provide additional details about the nature of the error.

Best post body:
Hey guys, I get this error when I try to open some pages with user data (like public reviews or user profile). It also happens on other pages. I’m not exposing no API keys Any idea how to fix it?",An error occurred in the Server Components render. The specific message is omitted in production builds to avoid leaking sensitive details. A digest property is included on this error instance which may provide additional details about the nature of the error.,https://reddit.com/r/nextjs/comments/1szcrz8/an_error_occurred_in_the_server_components_render/,0,11,22.0,22.0,11.9,0.0,18.0,0.127,nextjs(1),"nightmare, need help",11,0.6667,0.5127,0.0,0.2857,0.5,0.0,38.7
139,1,1t39mu0,How do you implement different backend API URL per environment?,"- How do you implement different backend API URL per environment?

Best post body:
To my understanding, nextjs adds NEXT\PUBLIC envs at build time. The problem is, my dev/staging and prod env uses the same image that was built by CI pipeline, so i cant use different .env file for each environment. My current solution is by not having a backend API URL and just assume that the backend is at the same URL as the frontend but on /api path. But i find this not very flexible because i might want the backend to have its own domain one day.",How do you implement different backend API URL per environment?,https://reddit.com/r/nextjs/comments/1t39mu0/how_do_you_implement_different_backend_api_url/,5,10,12.0,12.0,17.9,0.0,56.0,0.035,nextjs(1),manually,15,0.25,0.5721,0.0,0.8889,0.5,0.0,38.5
68,2,"1t5c332, 1sujmyt",Best React Native resources for 2026?,"- Best React Native resources for 2026?
- Django Allauth + React Native

Best post body:
Hi all, I’m starting with React Native and looking for up-to-date tutorials, courses, or projects for beginners to intermediate learners. Any recommendations that really helped you?",Best React Native resources for 2026? | Django Allauth + React Native,https://reddit.com/r/webdev/comments/1t5c332/best_react_native_resources_for_2026/,12,11,11.0,14.0,11.6,13.5,9.0,0.262,"webdev(1), django(1)","recommendations, does anyone",23,0.2083,0.6558,0.5,0.1429,0.5,0.0,38.0
83,1,1skumgk,Should every project have ai in it to make it impressive nowadays,"- Should every project have ai in it to make it impressive nowadays

Best post body:
so recently i made a recommendation system project, because i really like movies, so thought this is a cool idea was about to go to LinkedIn to post it, but came across 2-3 ai projects and got demotivated, felt I did nothing special this is me also asking for review, if it is a decent project to showcase my knowledge. or I should actually make some ai projects Features: Collaborative Filtering recommendations — personalised suggestions using Matrix Factorization Content-based recommendations — TF-IDF on movie metadata (genre, cast, director, keywords, overview) + cosine similarity Popularity-based recommendations — weighted ranking using rating count and average rating Preference-based recommendations — users select movies to receive similar recommendations based on their choices",Should every project have ai in it to make it impressive nowadays,https://reddit.com/r/datascience/comments/1skumgk/should_every_project_have_ai_in_it_to_make_it/,7,17,14.0,14.0,17.2,12.0,0.0,0.214,datascience(1),recommendations,24,0.3333,0.6642,0.4444,0.0,0.5,0.0,38.0
85,1,1t5q9mw,Good Youtube content on mobile app dev?,"- Good Youtube content on mobile app dev?

Best post body:
Hi, I hope to get some good recommendations on Youtube courses covering mobile app development (iOS/Android, preferably both like React Native). I know some React, FastAPI, Flask, and have built web tools before, but not mobile app. I hope to first watch some quality Youtube videos to get me started. I'm looking for multi-hour ""courses"", not 10 min ""intros"". Please recommend some good ones. Thanks",Good Youtube content on mobile app dev?,https://reddit.com/r/webdev/comments/1t5q9mw/good_youtube_content_on_mobile_app_dev/,1,2,14.0,14.0,8.6,12.0,31.0,0.51,webdev(1),recommendations,3,0.3333,0.2861,0.4444,0.4921,0.5,0.0,37.8
133,1,1t443qo,added a feedback page and mobile optimization to Script7 here is why,"- added a feedback page and mobile optimization to Script7 here is why

Best post body:
two things i just pushed to all users feedback page. before you had to scroll through the report page find my contact info and reach out manually. not practical at all. now there is a dedicated page inside the app. you write your feedback click send i get it instantly mobile optimization. most of my users are on mobile but script7 was built for desktop. that was killing my retention. it is not perfect yet but it is a real improvement and i am still working on it just trynna remove every friction point i can find",added a feedback page and mobile optimization to Script7 here is why,https://reddit.com/r/indiehackers/comments/1t443qo/added_a_feedback_page_and_mobile_optimization_to/,3,36,12.0,12.0,20.4,0.0,37.0,0.185,indiehackers(1),manually,39,0.25,0.7612,0.0,0.5873,0.5,0.0,37.8
71,1,1t4hels,Freelancers - is Figma a necessary evil?,"- Freelancers - is Figma a necessary evil?

Best post body:
I'm working on getting my freelance pipeline up and running on the side of my 9-5 job. I love designing and building websites, but I kinda hate using Figma. I usually prefer to ""design as I build"" in a way that involves a lot of constant tweaks, trial and error, so on and so forth. It makes sense that for freelance projects though, some sort of design agreement would seem necessary, so they can see what their site will look like before I go in and do all the work of building. Do you all use Figma? Do you like it? Are there any other ways to present designs to the client, or should I just bite the bullet and get used to it? Thanks",Freelancers - is Figma a necessary evil?,https://reddit.com/r/webdev/comments/1t4hels/freelancers_is_figma_a_necessary_evil/,0,45,14.0,14.0,14.7,0.0,4.0,-0.148,webdev(1),hate,45,0.3333,0.79,0.0,0.0635,0.5,1.0,37.6
105,1,1rx9ylr,Low-Code and SQL – Brief Insights from Real-World Experience,"- Low-Code and SQL – Brief Insights from Real-World Experience

Best post body:
I’ve been working with various low-code platforms for several years now (mostly with GAPTEQ), and there’s one thing I’ve noticed time and again: 👉 Low-code works best when it doesn’t replace SQL, but rather leverages it. Why? Many purely no-code approaches quickly reach their limits—at the latest when it comes to data models, performance, or complex filter logic. This leads to workarounds that only SQL could actually solve more elegantly. What has proven effective in my projects: UI, forms, validation → Low-code Data operations, filters, aggregations → SQL More complex workflows → Views or stored procedures This offers three advantages: ✔️ Faster implementation (for complex requirements) ✔️ Cleaner solutions using a standardized query language (SQL) ✔️ Easier to maintain (understandable to any developer) My conclusion: Low-code + SQL is the combination that causes the fewest headaches in the long run. What are your experiences? Especially when requirements get a bit more complex?",Low-Code and SQL – Brief Insights from Real-World Experience,https://reddit.com/r/lowcode/comments/1rx9ylr/lowcode_and_sql_brief_insights_from_realworld/,1,8,12.0,12.0,14.0,10.0,28.0,0.251,lowcode(1),headache,9,0.25,0.4751,0.3704,0.4444,0.5,0.0,37.3
132,1,1t59buf,Would love to see how people actually visualize dependencies on real projects,"- Would love to see how people actually visualize dependencies on real projects

Best post body:
Trying to improve the way we handle dependencies because right now it still feels more confusing than it should be once projects get even slightly complex. We have dependencies documented, technically everything is tracked but in practice it’s still hard to quickly understand what blocks what and which delays will actually affect other work. I’ve tried a few different setups already, timelines, linked tasks, dependency maps, even color coding stuff but none of it really feels clean once there are many moving pieces and multiple teams involved. Would honestly love some inspo from people who feel like they found setups that actually work in real life. Screenshots/examples/workflow ideas would be super interesting.",Would love to see how people actually visualize dependencies on real projects,https://reddit.com/r/projectmanagement/comments/1t59buf/would_love_to_see_how_people_actually_visualize/,14,13,12.0,12.0,20.9,0.0,41.0,0.117,projectmanagement(1),manually,27,0.25,0.6876,0.0,0.6508,0.5,0.0,37.3
104,1,1t51y8x,Are early-stage startups over-investing in marketing too soon? (I will not promote),"- Are early-stage startups over-investing in marketing too soon? (I will not promote)

Best post body:
Seeing a trend where startups start building marketing engines very early—ads, content, outbound, tools, etc. But in many cases, product and positioning are still evolving. From what I’ve observed, this sometimes leads to: High CAC Low conversion Confusing messaging For founders here: When did you start investing seriously in marketing? What worked before product-market fit vs after? Did you rely more on outbound, inbound, or partnerships early on? Would be helpful to hear what actually worked in the early stages vs what didn’t.",Are early-stage startups over-investing in marketing too soon? (I will not promote),https://reddit.com/r/startups/comments/1t51y8x/are_earlystage_startups_overinvesting_in/,0,17,12.0,12.0,13.2,0.0,48.0,0.209,startups(1),manually,17,0.25,0.5964,0.0,0.7619,0.5,0.0,37.1
69,1,1t55mr0,docker request truncation bug bypasses AuthZ plugins (CVE-2026-34040),"- docker request truncation bug bypasses AuthZ plugins (CVE-2026-34040)

Best post body:
Docker v29.3.1 dropped in March with a fix for CVE-2026-34040 (CVSS 8.8) the bug is weird. Dockers middleware strips request bodies over \1mb before AuthZ plugins see them but the daemon still processes the full thing. so the plugin evaluates an empty body, approves it, and the daemon runs whatever was actually in the request the AuthZ plugin and daemon are literally looking at different requests craft an oversized request, plugin sees nothing suspicious and approves it, daemon executes the full payload with elevated access. could spin up privileged containers, read bind mounted host files, maybe even break out depending on how things are configured this is supposedly related to CVE-2024-41110 from last year which was ""fixed"" but apparently not really. i'm starting to think nobody actually tests these patches mainly a problem if you expose the Docker API over TCP (even internally), run CI/CD that talks to Docker remotely, or lean on AuthZ plugins for access control check your version: docker version --format '{{.Server.Version}}' anything under 29.3.1 has the bug if your Docker API is network accessible this is one to actually fix rather than add to the backlog and forget about just ran into this while auditing our infra and would love to hear your thoughts",docker request truncation bug bypasses AuthZ plugins (CVE-2026-34040),https://reddit.com/r/devops/comments/1t55mr0/docker_request_truncation_bug_bypasses_authz/,17,4,14.0,14.0,17.3,0.0,34.0,0.069,devops(1),hate,21,0.3333,0.6378,0.0,0.5397,0.5,0.0,36.7
110,1,1sxx29p,The summarization trap in AI Ops: why most agents are just glorified search bars for the docs,"- The summarization trap in AI Ops: why most agents are just glorified search bars for the docs

Best post body:
Is it just me, or is the current state of AI Agents for DevOps basically just R͏AG over documentation with a fancy U͏I? I’ve been sitting through demos lately where the promise is autonomous incident response, but when you peel back the hood, the logic is almost always: \\- scrape docs, \\- summarize a runbook, \\- open a Jira ticket with the summary. That’s not an ag͏ent, that’s just a faster way to read. In a real production environment, I don’t need an AI to tell me what the docs say - I need it to understand the state of the stack. A useful agent should be able to exe͏cute specific steps, respect human-in-the-loop checkpoints, and, most importantly, have the context of the actual conversation happening in the workspace. I’ve been digging into how to actually bu͏ild/dep͏loy something that isn't a black box. A few different approaches I’m looking at: Workflow-heavy (n͏8n/Pipe͏dream): great for visibility, but you end up maintaining massive logic trees manually. Context-first (Brid͏geApp): interesting because it tries to bridge the gap between the LLM and the actual workspace (tasks, Slack threads, etc.), which at least solves the context problem. Custom internal tooling: building wrappers around existing CLI tools, but that's a massive sink for engineering hours. The real friction point seems to be exception handling. How do you let an agent run a diagnostic script but force a human sign-off before it touches a production config? Has anyone actually moved past the fancy search phase? Or are we still 2 years away from AI ops tools that can actually be trusted with a shell script?",The summarization trap in AI Ops: why most agents are just glorified search bars for the docs,https://reddit.com/r/devops/comments/1sxx29p/the_summarization_trap_in_ai_ops_why_most_agents/,4,15,12.0,12.0,15.5,0.0,44.0,0.099,devops(1),manually,19,0.25,0.6181,0.0,0.6984,0.5,0.0,36.6
135,1,1sy5m65,"Built a CLI to scaffold React projects in one command — Vite, Tailwind, shadcn/ui, TypeScript all supported","- Built a CLI to scaffold React projects in one command — Vite, Tailwind, shadcn/ui, TypeScript all supported

Best post body:
Hey r/reactjs, I got tired of running create-react-app or manually setting up Vite + Tailwind + TypeScript every time. So I built pic-li. npm install -g pic-cli-tool pic create my-app --stack react-vite --template tailwind-shadcn Templates available for React: default → React + Vite, ready to run tailwind → React + Vite + Tailwind CSS v3 tailwind-shadcn → React + Vite + Tailwind + shadcn/ui typescript → React + Vite + TypeScript Or use the interactive mode: pic create my-app (arrow key menus guide you through everything) You can also add integrations to existing React projects: pic add tailwind pic add eslint pic add docker pic add firebase And if you're going fullstack: pic create my-app --stack mern --template with-auth (React + Express + MongoDB + JWT auth all wired together) Just open sourced it — feedback on the generated React structure would be really helpful. GitHub: [","Built a CLI to scaffold React projects in one command — Vite, Tailwind, shadcn/ui, TypeScript all supported",https://reddit.com/r/reactjs/comments/1sy5m65/built_a_cli_to_scaffold_react_projects_in_one/,0,8,12.0,12.0,10.9,0.0,58.0,0.05,reactjs(1),manually,8,0.25,0.4534,0.0,0.9206,0.5,0.0,36.6
145,1,1sk90yl,anyone actually building stuff? tired of the ai hype,"- anyone actually building stuff? tired of the ai hype

Best post body:
happy monday everyone. is it just me or is every ai sub just becoming a wall of ""top 10 tools"" and ""how to make $10k with gpt"" posts? it’s getting pretty annoying. a few of us are starting a biweekly thing from today just to talk about what we’re actually building. no pitches or ""thought leadership"" garbage, just people sharing: what they tried to ship this week tools that actually worked (and which ones were a waste of money) workflows that aren't just basic prompts where they’re currently stuck/failing if you’re actually getting your hands dirty with code or prompt engineering and want to talk shop with people who get it, you should join. we’re keeping it pretty low-key. drop a comment if you're are up to share or just show up. see ya there.",anyone actually building stuff? tired of the ai hype,https://reddit.com/r/indiehackers/comments/1sk90yl/anyone_actually_building_stuff_tired_of_the_ai/,85,257,10.0,10.0,36.3,0.0,20.0,0.087,indiehackers(1),annoying,342,0.1667,1.0,0.0,0.3175,0.5,0.0,36.4
100,1,1sg86y9,"I built an open-source collaborative document editor with Next.js, TipTap, and Typst","- I built an open-source collaborative document editor with Next.js, TipTap, and Typst

Best post body:
I’ve been building \ladoc\, an open-source collaborative document editor that combines a Word-like writing experience with Typst-powered output. The idea is simple: write visually, keep the workflow approachable, and still get high-quality typesetting instead of fragile document layouts. Current stack: \- Next.js \- React \- TypeScript \- TipTap \- Typst WASM \- Prisma + PostgreSQL \- NextAuth \- Yjs + Hocuspocus \- next-intl Already working: \- visual editor \- live Typst preview \- templates \- autosave \- version history \- trash/restore \- real-time collaboration \- PDF export \- German + English i18n I’m currently looking for feedback and contributors, especially around: \- bibliography support for citations \- comments/review mode \- image/asset pipeline \- mobile polish \- overall editor UX Repo: [ladoc]( If this sounds interesting, I’d love feedback, issues, or contributions.","I built an open-source collaborative document editor with Next.js, TipTap, and Typst",https://reddit.com/r/reactjs/comments/1sg86y9/i_built_an_opensource_collaborative_document/,1,11,12.0,12.0,14.1,0.0,43.0,-0.03,reactjs(1),painful,12,0.25,0.5293,0.0,0.6825,0.5,0.3436,36.3
77,1,1sussr1,Tips for a PM with ADHD?,"- Tips for a PM with ADHD?

Best post body:
I am an early career PM with a lot of PM related training - Management UG degree with a certificate in Project Management, PMI cert, and currently pursuing a Masters in Management. Frankly, I think I did well in college through a deep terror of disappointing my parents, siblings who had completed the degree already and could tutor, sheer determination, and baseline being “good at school”. I did not know I had ADHD at the time. In college, all projects are hypothetical, perfect, or low stakes. Now I have an actual job, as a project manager, and… I am not sure I am the most organized person as a baseline? I’m doing okay, and have found strategies that work alright, but I wish I could be excellent. Currently, I am bullet journaling for personal to-dos and follow ups, and aggressively cleaning my inbox to remove things that are complete or non actionable. It doesn’t help that my organization has no PMS systems in place and no organizational structure to support it. I’m also a lone PM, of sorts - the primary business of the business is NOT what I’m handling - I’m in higher ed and I do project management for our ancillary professional educational programs, marketing project management for our degree advertising, and assorted projects to assist the Dean in his various efforts. I’d love to hear suggestions on organizational strategies, especially when handling multiple projects, and especially when organizational culture is not focused on a project mindset. I feel I’m struggling with the “juggling” aspects most of all - if it was one project I could focus on I feel I’d be doing better, but because I am handling so many disparate projects it feels overwhelming and chaotic. I do know that, in a large part, “overwhelming and chaotic” is the world of the PM, I just also know my job is to make chaos orderly - or at least directed and productive chaos. Thank you all in advance! Happy to answer questions if needed.",Tips for a PM with ADHD?,https://reddit.com/r/projectmanagement/comments/1sussr1/tips_for_a_pm_with_adhd/,38,55,14.0,14.0,25.8,0.0,7.0,0.226,projectmanagement(1),excel,93,0.3333,0.9375,0.0,0.1111,0.5,0.0,36.2
53,1,1t8n7of,How do I find testers and early buyers for my analytics product?,"- How do I find testers and early buyers for my analytics product?

Best post body:
Hi everyone, I’m based in Northern Ireland and I’ve built an product analytics product basically “ChatGPT for business data.” It lets business owners ask questions about their data in plain English and get insights, trends, and reports without digging through spreadsheets or dashboards. I’m now looking for testers and early buyers, but I’m not sure how to reach the right people without cold messages feeling spammy. For anyone who’s launched a B2B SaaSl, or analytics product, how did you find your first testers or customers? Would a free trial, live demo, data audit, or small pilot work best at this stage? Mainly trying to get real feedback and speak to business owners who might actually need this. Any advice appreciated.",How do I find testers and early buyers for my analytics product?,https://reddit.com/r/smallbusiness/comments/1t8n7of/how_do_i_find_testers_and_early_buyers_for_my/,0,12,16.0,16.0,10.5,0.0,32.0,0.095,smallbusiness(1),spreadsheet,12,0.4167,0.5293,0.0,0.5079,0.5,0.0,36.1
117,1,1stzr9u,Which fields are most and least likely to be impacted by AI?,"- Which fields are most and least likely to be impacted by AI?

Best post body:
Certainly AI will affect how much coding we do by hand. The actual data science part is harder to automate, because every problem requires business context and an understanding of how to achieve your goal with the data you have. That being said, as someone who has concentrated heavily in one niche (forecasting), I am curious which fields in DS/ML people think are most or least likely to be automated substantially by AI. Forecasting, Optimization, A/B testing, Causal Inference, Vision, Anomaly Detection, etc?",Which fields are most and least likely to be impacted by AI?,https://reddit.com/r/datascience/comments/1stzr9u/which_fields_are_most_and_least_likely_to_be/,35,56,12.0,12.0,25.4,0.0,15.0,0.035,datascience(1),by hand,91,0.25,0.933,0.0,0.2381,0.5,0.0,36.0
