group_id,post_count,post_ids,rep_title,combined_text,sample_titles,top_url,total_upvotes,total_comments,avg_pain_score,max_pain_score,avg_engagement,avg_buying_intent,avg_buildability,avg_sentiment,top_subreddits,top_signals,total_engagement,pain_norm,eng_norm,intent_norm,build_norm,valid_norm,sent_norm,final_score
91,1,1sptzum,Built a Django app for a client – no idea how much to charge. Need pricing advice.,"- Built a Django app for a client – no idea how much to charge. Need pricing advice.

Best post body:
I just finished a Django project by vibe coding – but not with Cursor. I pasted everything into files manually, line by line. So I actually understand the basics and how everything fits together. Project features: Login / Signup Examination page Custom admin panel with tabs for dashboard, exam config, key sessions, student records, and question CRUD (multiple choice, true/false, abstract reasoning) Stack: Bootstrap + SQLite The client wants it fast, and I also want to learn Django more deeply. My questions: 1. How much should I charge for this (Philippines rates)? 2. What should I learn next to level up from beginner to intermediate? Specific topics, projects, or resources would help a lot. Also – how do you actually learn them effectively?",Built a Django app for a client – no idea how much to charge. Need pricing advice.,https://reddit.com/r/django/comments/1sptzum/built_a_django_app_for_a_client_no_idea_how_much/,10,27,12.0,12.0,19.7,0.0,17.0,0.146,django(1),manually,37,0.25,0.7506,0.0,0.2698,0.5,0.0,32.8
114,1,1t4gqha,When would you NOT use low-code? Honest take after years in the space,"- When would you NOT use low-code? Honest take after years in the space

Best post body:
I've been working with low-code platforms for a while now – both evaluating them and building things with them. And honestly, one of the most useful conversations I rarely see here is: when should you not use low-code? Here's my personal list of red flags: 1. When your logic is truly complex If your business logic has dozens of edge cases, nested conditions, and exceptions to exceptions – low-code starts fighting you. You spend more time working around the platform than building. 2. When you need serious scalability from day one Internal tools for 20 users? Perfect. Customer-facing app that needs to handle 50k concurrent users with sub-100ms response times? Probably not the right fit. 3. When the team is all senior devs anyway The main value of low-code is speed and accessibility. If your whole team writes clean code fast, the abstraction layer might just slow them down. 4. When vendor lock-in is a dealbreaker Some platforms make it very hard to export or migrate your logic. If long-term portability matters, go in with open eyes. 5. When the UI needs to be highly custom Pixel-perfect, brand-driven, heavily animated interfaces – most low-code tools struggle here. You'll hit walls. Curious what others would add. I work in this space (full disclosure: I'm at a low-code company), so I try to stay honest about the limits. What's your ""never again"" low-code story?",When would you NOT use low-code? Honest take after years in the space,https://reddit.com/r/lowcode/comments/1t4gqha/when_would_you_not_use_lowcode_honest_take_after/,5,13,12.0,12.0,18.5,0.0,29.0,0.161,lowcode(1),painful,18,0.25,0.6076,0.0,0.4603,0.5,0.0,32.8
156,1,1suce4q,How does anyone actually manage this many moving pieces?,"- How does anyone actually manage this many moving pieces?

Best post body:
Just passed my 6th month managing projects, coming from a more technical role. I honestly don’t get how people keep everything together. I feel like I’m constantly missing something and always one step behind what’s actually happening. On paper it looks simple: tasks, timelines, dependencies. But in reality it’s like everything depends on something else and half of it isn’t even written down anywhere. It’s also weird being responsible for delivery but not really having control over the people doing the work. I’m expected to own the outcome but I can’t force decisions, can’t unblock things myself most of the time and still somehow it all rolls up to me. We have tools, boards, trackers, all of that… but I’m starting to feel like they don’t reflect what’s actually going on. Things look in progress forever, blockers show up too late and I find out about issues only when they’re already problems. There wasn’t much onboarding either, so I’ve been trying to piece things together as I go. I spend a lot of time just trying to understand what matters vs what just looks important. I log in and immediately feel overwhelmed. Like I should know what to do next but I don’t always trust that I’m focusing on the right thing. I’ve handled complex stuff before in other roles but this feels different. Less about doing the work, more about trying to keep everything from drifting apart. Not planning to leave or anything, just trying to figure out how people actually get good at this. Right now it just feels like I’m reacting to things more than managing them.",How does anyone actually manage this many moving pieces?,https://reddit.com/r/projectmanagement/comments/1suce4q/how_does_anyone_actually_manage_this_many_moving/,58,52,8.0,8.0,27.0,0.0,16.0,0.096,projectmanagement(1),does anyone,110,0.0833,0.9718,0.0,0.254,0.5,0.0,32.8
37,3,"1stbxvy, 1stk3l0, 1sy3kz1",Need help finding a UI library,"- Need help finding a UI library
- Do you need help?
- I need help with quote calculator!

Best post body:
Hey all, I came across a UI library that has a minimal version of this lando helmet cursor animation, for the sake of God i cant find it anywhere now.. does anyone know?",Need help finding a UI library | Do you need help? | I need help with quote calculator!,https://reddit.com/r/reactjs/comments/1stbxvy/need_help_finding_a_ui_library/,12,31,12.0,24.0,14.1,4.0,1.0,0.002,"reactjs(1), django(1), sweatystartup(1)","need help, anyone know, does anyone",43,0.25,0.7808,0.1481,0.0159,0.5,0.0,32.6
148,1,1szsg4w,"Finally realized how much i was abusing useEffect, and deleting them is the best feeling ever..","- Finally realized how much i was abusing useEffect, and deleting them is the best feeling ever..

Best post body:
Confession time. for the longest time, my default reaction to ANY data change in my app was to immediately reach for a useEffect. If prop A changed, i had an effect to update state B. which naturally triggered another effect to fetch some data, which updated state C. My components basically ran like a fragile Rube Goldberg machine of dependency arrays, and i was constantly fighting infinite render loop warnings. I finally sat down and properly read the ""You Might Not Need an Effect"" section of the React docs. the realization that you can just... derive variables during the render cycle... completely shifted how i write code now 😄","Finally realized how much i was abusing useEffect, and deleting them is the best feeling ever..",https://reddit.com/r/reactjs/comments/1szsg4w/finally_realized_how_much_i_was_abusing_useeffect/,285,80,10.0,10.0,40.4,0.0,3.0,0.035,reactjs(1),annoying,365,0.1667,1.0,0.0,0.0476,0.5,0.0,32.4
92,1,1sotlik,Writing React like SolidJS: a Babel plugin that makes observables first-class,"- Writing React like SolidJS: a Babel plugin that makes observables first-class

Best post body:
Hey r/reactjs, TL;DR — I built a Babel plugin on top of Legend-State that does two things: 1. Auto-wraps obs$.get() calls inside JSX as fine-grained memo leaves — no <Memo, no observer() HOC, no manual memoization for JSX reads. 2. Adds a ""use scope"" directive that turns the component body into a run-once setup block — so you can call observable() / observe() directly, Solid/Svelte style, without any hook wrapper. GitHub → auto-memo leaf Any observable.get() call inside JSX gets wrapped into a fine-grained memo leaf at compile time — whether it sits in a text node, an attribute, or an arbitrary expression. The parent component function runs once, and only the specific read that depends on the observable recomputes. No observer() HOC, no selector functions, and no manual memoization for JSX reads (useMemo / React.memo are still fair game elsewhere in your code — this is purely about rendering). // what you write <buttonClicked {count$.get()} times</button // compiled output <buttonClicked <Memo{() = count$.get()}</Memo times</button The existing Legend-State plugin mostly rewrites <Memo{count$.get()}</Memo that you already wrote by hand into <Memo{() = count$.get()}</Memo. This plugin goes one step further: it detects the $.get() pattern itself, so you never have to think about <Memo at all. 2. ""use scope"" directive — observables as first-class citizens The problem. In observable/signal-based frameworks like SolidJS, Svelte, or Vue's setup(), the component body runs exactly once per mount. When state changes, the reactive system propagates updates — it doesn't re-run the function. React works the other way. State changes re-run the whole function body. That makes writing observable-style code awkward: function Counter() { // ❌ new observable instance every render — every prior subscription is lost const count$ = observable(0); // ❌ observe() is re-registered every render, the previous one never cleans up observe(() = { document.title = Count: ${count$.get()}; }); ret",Writing React like SolidJS: a Babel plugin that makes observables first-class,https://reddit.com/r/reactjs/comments/1sotlik/writing_react_like_solidjs_a_babel_plugin_that/,0,11,12.0,12.0,9.6,0.0,34.0,0.062,reactjs(1),by hand,11,0.25,0.5127,0.0,0.5397,0.5,0.0,32.1
73,1,1si63ku,I built a small React library called react-youtube-jukebox,"- I built a small React library called react-youtube-jukebox

Best post body:
I was frustrated that most YouTube embeds feel like raw iframes, not something that fits naturally into a product UI. So I tried building a floating player + inline playlist that behaves more like a real component. It provides two components: \- <Playlist for a Spotify-like playlist UI \- <Jukebox as a minimal, unobtrusive floating player It also: \- lazy-loads the YouTube iframe API \- keeps the package small (React as a peer dependency) \- is MIT licensed Demo / docs: [ GitHub: [ Would love feedback on: \- API design \- playlist UX \- whether the floating player approach feels useful in real apps",I built a small React library called react-youtube-jukebox,https://reddit.com/r/reactjs/comments/1si63ku/i_built_a_small_react_library_called/,1,2,14.0,14.0,8.7,0.0,30.0,-0.056,reactjs(1),frustrated,3,0.3333,0.2861,0.0,0.4762,0.5,0.6415,31.9
66,1,1t8vwwe,Best way to integrate real Microsoft Excel into a React web app?,"- Best way to integrate real Microsoft Excel into a React web app?

Best post body:
I’m building a React-based web application and I want to integrate Microsoft Excel directly into the browser experience. My main goal is to provide users with an experience as close as possible to the real Microsoft Excel UI and functionality. I explored options like: Handsontable AG Grid Luckysheet SheetJS But these are Excel-like solutions, not actual Microsoft Excel. My ideal outcome would be: Excel-like editing directly inside the web app Preserve original Excel behavior/features Support large datasets Possibly collaborative editing in the future I’d appreciate guidance on: recommended architecture real-world experience best tech stack whether this approach is even realistic Thanks!",Best way to integrate real Microsoft Excel into a React web app?,https://reddit.com/r/reactjs/comments/1t8vwwe/best_way_to_integrate_real_microsoft_excel_into_a/,6,11,14.0,14.0,15.4,0.0,17.0,0.292,reactjs(1),excel,17,0.3333,0.5964,0.0,0.2698,0.5,0.0,31.8
113,1,1sh4h1u,I develop a type-safe i18n that works anywhere with typeScript,"- I develop a type-safe i18n that works anywhere with typeScript

Best post body:
[]( I got tired of framework-locked translation libraries so built better-translate around one idea: same implementation, any project Full TypeScript support: keys, params, everything autocompleted (.ts or .json) Know exactly which keys are missing across locale files, no more guessing Switch languages, list available ones, see what's incomplete Don't want to manage translation files manually? Use better-translate/cli (built on top of ai-sdk): Write t(""this is a test, no worries"", { bt: true }) and the CLI converts it to t(""test.noWorries""), generates all your locale files (.json, .ts, .md/.mdx) automatically I also developed adapters for react, next.js, TanStack Router, Astro and MD/MDX, it also works on any API framework (Express, Elysia, etc.) too. Fully open source ([ fork it, build your own adapters. If it runs TypeScript, it runs better-translate. Would love feedback and suggestions 🙏 [",I develop a type-safe i18n that works anywhere with typeScript,https://reddit.com/r/nextjs/comments/1sh4h1u/i_develop_a_typesafe_i18n_that_works_anywhere/,1,5,12.0,12.0,9.6,0.0,39.0,0.169,nextjs(1),manually,6,0.25,0.4015,0.0,0.619,0.5,0.0,31.1
119,1,1szhfhp,Why are most CRMs still built like databases instead of assistants?,"- Why are most CRMs still built like databases instead of assistants?

Best post body:
I’ve spent a lot of time exploring CRM tools recently, and I keep noticing the same issue: Most CRMs are great at storing data, but not at actually helping users take action. You still have to manually update fields, set reminders, and interpret what matters. With AI where it is now, it feels like CRMs should work more like assistants, understanding conversations, surfacing context, and suggesting next steps. That shift toward intelligence over administration seems overdue. I’ve been building around that idea, but I’m curious what do you think the future of CRM should actually look like? PS. I would love to give a free trial of what im building, if your interested dm me or comment, if not totally fine I mainly want to hear the perspective of different people.",Why are most CRMs still built like databases instead of assistants?,https://reddit.com/r/CRM/comments/1szhfhp/why_are_most_crms_still_built_like_databases/,0,19,12.0,12.0,11.7,0.0,21.0,0.174,CRM(1),manually,19,0.25,0.6181,0.0,0.3333,0.5,0.0,31.1
98,1,1senaqa,I built a better devtool for Zustand (shows why state changed),"- I built a better devtool for Zustand (shows why state changed)

Best post body:
Debugging Zustand state changes still feels a bit painful. Redux DevTools shows ""what"" changed, but not really ""why"" or what actually triggered it in a clear way. So I built a small devtool called zustand-flow. It lets you: \- see every state change as a timeline \- track which action caused it \- inspect previous vs next state \- understand what actually happened (not just the result) Demo: [ GitHub: [ Would love feedback — especially what’s missing to make this actually useful in daily dev.",I built a better devtool for Zustand (shows why state changed),https://reddit.com/r/reactjs/comments/1senaqa/i_built_a_better_devtool_for_zustand_shows_why/,5,2,12.0,12.0,12.7,0.0,16.0,-0.101,reactjs(1),painful,7,0.25,0.4291,0.0,0.254,0.5,1.0,31.1
93,1,1su81pj,Building a CLI with Playwright and running into auth/session issues.,"- Building a CLI with Playwright and running into auth/session issues.

Best post body:
I have a command like: app browser screenshot /dashboard The goal is for developers to quickly take screenshots of internal app pages for testing/debugging and things like creating user guides with lots of screenshots. Current flow: app browser login This command prompts for email + password in the terminal, opens Playwright, logs in, and saves the browser session. Then: app browser screenshot /dashboard should reuse that session and capture the page. Problem: login succeeds, session gets “saved”, but the next screenshot command still says: ✗ No saved session or session expired. Run app browser login first. I understand this happens because each CLI command launches a fresh Playwright browser/context, so IndexedDB/localStorage/session state isn’t carrying over properly. The issue is I don’t want to log in every single time just to take a screenshot. If I’m creating a user guide and need 30+ screenshots, I can’t keep logging in 30 times. At the same time, I also don’t want to save raw credentials like email/password in a file for security reasons. So what’s the right approach here? How do people usually handle persistent authenticated Playwright sessions in a CLI like this without forcing repeated logins or storing credentials insecurely?",Building a CLI with Playwright and running into auth/session issues.,https://reddit.com/r/nextjs/comments/1su81pj/building_a_cli_with_playwright_and_running_into/,1,4,12.0,12.0,10.8,0.0,41.0,0.091,nextjs(1),manually,5,0.25,0.3697,0.0,0.6508,0.5,0.0,30.9
51,1,1t5fsuo,when did you stop handling FBA prep yourself?,"- when did you stop handling FBA prep yourself?

Best post body:
i sell small home organizer items and a few kitchen accessories on amazon, mostly stuff i import in small batches from china. i used to prep everything myself because the volume was low and i wanted to double check labels, poly bags, and carton counts before sending anything to FBA. lately it’s been eating up too much time. i’ll plan to work on sourcing or listings, then somehow spend half the day printing FNSKU labels, checking boxes, and fixing carton info. had one shipment delayed last month because i messed up the box labels, so now i’m a little paranoid. been looking at prep centers and freight options, found ardiexpress where they mention china to us freight and FBA prep but not suree yet about anything what point did you stop doing prep yourself and hand it off? who do your recommend ussing?",when did you stop handling FBA prep yourself?,https://reddit.com/r/ecommerce/comments/1t5fsuo/when_did_you_stop_handling_fba_prep_yourself/,0,9,16.0,16.0,9.6,0.0,0.0,-0.059,ecommerce(1),too much time,9,0.4167,0.4751,0.0,0.0,0.5,0.6758,30.8
137,1,1t4sl0h,How are you testing your nextjs apps?,"- How are you testing your nextjs apps?

Best post body:
I'm working on a nextjs app that doesn't have RTL and MSW. I'm coming from the SPA world and I'm used to write a lot of user behaviour tests. Just wondering what is the value of adding RTL and MSW and how/what you normally test in nextjs apps?",How are you testing your nextjs apps?,https://reddit.com/r/nextjs/comments/1t4sl0h/how_are_you_testing_your_nextjs_apps/,5,7,12.0,12.0,16.4,0.0,27.0,0.181,nextjs(1),manually,12,0.25,0.5293,0.0,0.4286,0.5,0.0,30.8
130,1,1t92d5w,Using sqlite with NodeJS for website's backend,"- Using sqlite with NodeJS for website's backend

Best post body:
Building a light traffic website, mostly readonly. I am planning to use SQLite, a file based database. The purpose of this website isn't transations, but tracking some data. Do you think this is a good choice? any treadoff that I can't compensate later/",Using sqlite with NodeJS for website's backend,https://reddit.com/r/webdev/comments/1t92d5w/using_sqlite_with_nodejs_for_websites_backend/,4,16,12.0,12.0,20.3,0.0,19.0,0.161,webdev(1),painful,20,0.25,0.6282,0.0,0.3016,0.5,0.0,30.8
74,1,1t7f4j1,nextjs feels like it's liability framework now,"- nextjs feels like it's liability framework now

Best post body:
long time nextjs dev within the last 2 to 3 years, feels like nextjs / react has vulnerability / security issues to the point of it being every other week now not saying it's a bad thing for software since bugs happen. but to have security issues every other week? that's a fucking liability where you are expected to update everything to make sure everything still works etc. i have yet to witness a single angular or tanstack start related security incident within the last few years vs nextjs + react",nextjs feels like it's liability framework now,https://reddit.com/r/nextjs/comments/1t7f4j1/nextjs_feels_like_its_liability_framework_now/,0,16,14.0,14.0,14.6,0.0,8.0,-0.018,nextjs(1),fed up,16,0.3333,0.5846,0.0,0.127,0.5,0.2062,30.5
124,1,1t6veip,Ansible/container workflow,"- Ansible/container workflow

Best post body:
I'm used to backend projects having a prod stack.yaml you can deploy to a swarm. The directory structure would look like: project/ |-- fake-db/ |-- fake-other-thing/ |-- app/ |-- docker-compose.yml -- stack.yml I've recently been doing quite a bit of Apache webserver config work. What I started with was a fairly hefty envvars file, but after awhile parody between environments became tedious enough to get me interested in using Ansible for it. Normally, when I have to develop on my own local webserver I just use an nginx container. It has and runs envsubst baked in so in my mind, if I ever deployed a production container, it would just follow the same sort of directory structure. But that suffers from the same limitation. So now I'm looking at templating an overall config per site with a common include that can still use an environment-specific directory root. (Love to hear feedback on this too) Anyway, if I'm gonna deploy a container, I have to use ansible to generate sites-available first. Should I tool it to take a path and drop it in a separate Web server container project? I can't imagine there'd be really anything else in there other than the generated configs and a stack file. You don't even bake the configs into deployed Services. They actually have a config flag for that; though I would mount the directory to test it. Or the ansible Project could have a stack file for deploying the container. Then the output directory would just be in the project and omitted from git. Then I guess I'd put a run-once-on-start-up ansible service in docker compose that I can run in isolation, but running ansible from a Docker container... is that typical? Any help is appreciated!",Ansible/container workflow,https://reddit.com/r/devops/comments/1t6veip/ansiblecontainer_workflow/,0,15,12.0,12.0,13.9,0.0,22.0,0.073,devops(1),tedious,15,0.25,0.5721,0.0,0.3492,0.5,0.0,30.4
57,1,1ser58w,Hey Builders! How do you handle RTL bugs,"- Hey Builders! How do you handle RTL bugs

Best post body:
I'm building a dashboard in Vite.js React, and I'm handling multiple languages. Adding Arabic is a nightmare, because the whole UI gets flipped😭 I'm new to React, please guide me",Hey Builders! How do you handle RTL bugs,https://reddit.com/r/reactjs/comments/1ser58w/hey_builders_how_do_you_handle_rtl_bugs/,1,8,16.0,16.0,13.3,0.0,12.0,0.112,reactjs(1),nightmare,9,0.4167,0.4751,0.0,0.1905,0.5,0.0,30.3
54,1,1sr01om,How perfect is your company data?,"- How perfect is your company data?

Best post body:
It’s a nightmare trying to find data I need in correct format while the company is in process of modernization. Also even if I find data I need to filter a lot of garbage out",How perfect is your company data?,https://reddit.com/r/datascience/comments/1sr01om/how_perfect_is_your_company_data/,4,13,16.0,16.0,15.3,0.0,0.0,1.0,datascience(1),nightmare,17,0.4167,0.5964,0.0,0.0,0.5,0.0,29.8
84,1,1t5756s,"Choosing between Squarespace, Hostinger and WordPress for a sound design portfolio","- Choosing between Squarespace, Hostinger and WordPress for a sound design portfolio

Best post body:
Hello! I'm a sound designer and I'm looking to build my own portfolio website. I don't need anything fancy, I just want something good-looking and easy to build. It would only have a home page, two portfolio pages with videos and pictures embedded of my work — linear audio and game audio — and an about/contact section, that's it. I've done some research and watched a video by Steve Builds Websites, and I've narrowed it down to three options: Squarespace: seems easy to use Hostinger: seems cheaper and more customizable WordPress: seems very customizable, and apparently you can move your hosting elsewhere (whatever that means, so I'd appreciate it if someone could explain) I don't know how to code websites, and honestly, learning web development is not my goal. My work already takes up a lot of time, so I'd like something I can get up and running fairly quickly. I don't want to spend more than a month building it, if that's possible. Out of these three options, which one would you recommend? Thank you in advance!","Choosing between Squarespace, Hostinger and WordPress for a sound design portfolio",https://reddit.com/r/webdev/comments/1t5756s/choosing_between_squarespace_hostinger_and/,5,15,14.0,14.0,17.2,0.0,3.0,0.266,webdev(1),hate,20,0.3333,0.6282,0.0,0.0476,0.5,0.0,29.1
140,1,1t10tk2,Vite is Terrible for Troubleshooting React,"- Vite is Terrible for Troubleshooting React

Best post body:
EDIT: When setting up my Browser Router, I setup the errorElement to a 404 page, which on webpack still shows you the trace but not with vite. Removing the error element fixed the problem. Will leave this up in case anyone else runs into this issue as well. I have used Webpack as my primary module bundler for most of my career but recently decided to give Vite a go and the experience has been awful. When something goes wrong and there's a runtime error, vite decides to simply default to your 404 page and display no errors. Furthermore, the console is completely empty so you have no idea what went wrong and you have to remove components until you find out the piece that went wrong instead of having an error you can debug. There's gotta be a better way than trying to figure out the error with no error message...",Vite is Terrible for Troubleshooting React,https://reddit.com/r/reactjs/comments/1t10tk2/vite_is_terrible_for_troubleshooting_react/,0,11,12.0,12.0,8.9,0.0,0.0,-0.175,reactjs(1),better way,11,0.25,0.5127,0.0,0.0,0.5,1.0,29.0
