group_id,post_count,post_ids,rep_title,combined_text,sample_titles,top_url,total_upvotes,total_comments,avg_pain_score,max_pain_score,avg_engagement,avg_buying_intent,avg_buildability,avg_sentiment,top_subreddits,top_signals,total_engagement,pain_norm,eng_norm,intent_norm,build_norm,valid_norm,sent_norm,final_score
15,1,1t7zudv,What Makes a Beginner Frontend Dev Stand Out?,"- What Makes a Beginner Frontend Dev Stand Out?

Best post body:
Been diving deeper into full stack web development recently and trying to move beyond just “copying tutorials” or vibe coding projects. Currently focusing on: \- JavaScript internals & OOP \- React and frontend architecture \- responsive UI/UX \- APIs & backend basics \- building cleaner and more scalable projects I’ve made a few projects already, but I’m realizing there’s a huge difference between making something work and actually understanding why it works. Also really interested in startup environments because I feel like working on real products with a small team would help me grow much faster than learning alone. Would love advice from people already in frontend/full stack: \- what should beginners focus on most? \- what helped you improve quickly? \- and what made you “job ready”? Open to feedback on projects/portfolio too.",What Makes a Beginner Frontend Dev Stand Out?,https://reddit.com/r/webdev/comments/1t7zudv/what_makes_a_beginner_frontend_dev_stand_out/,3,26,26.0,26.0,19.8,0.0,26.0,0.231,webdev(1),"hate, manually",29,0.8333,0.7018,0.0,0.4127,0.5,0.0,48.6
80,1,1t67j16,Need info regarding BA !,"- Need info regarding BA !

Best post body:
Guys , apart from doing mba in business analytics domain , is there any other path to enter into a business analyst role ? Are there any proper courses for it ? What skills are mostly required to get a BA role ?",Need info regarding BA !,https://reddit.com/r/analytics/comments/1t67j16/need_info_regarding_ba/,1,10,14.0,14.0,15.3,20.0,29.0,0.236,analytics(1),excel,11,0.3333,0.5127,0.7407,0.4603,0.5,0.0,47.8
18,1,1t5bg0c,"I got tired of Next.js runtime errors from missing environment variables, so I built next-safe-env (Open Source)","- I got tired of Next.js runtime errors from missing environment variables, so I built next-safe-env (Open Source)

Best post body:
Hey everyone, If you’ve built apps with Next.js, you’ve probably run into the nightmare of deploying a project only for it to crash because a required environment variable was missing or misspelled in your .env file. Relying on process.env.YOURVAR as string everywhere isn't just annoying; it’s risky. I wanted a simpler, foolproof way to handle this, so I built an open-source NPM package called next-safe-env. It’s designed to make environment variable validation in Next.js completely type-safe and effortless, catching missing or invalid variables at build time before they ever reach your users. What it does: 🔒 Type-Safe: Full TypeScript support so you get autocomplete for your env variables across your codebase. 🛡️ Runtime & Build-time Validation: Fails fast if required variables are missing. ⚡ Lightweight & Simple: Easy to integrate into any existing Next.js project without massive boilerplate. I would love for you guys to check it out, roast my code, or let me know what features you'd like to see next. Any feedback or GitHub stars would mean the world to me! Links: 🌐 Website & Docs:[next-safe-env.dev]( 📦 NPM:[npmjs.com/package/next-safe-env]( 🐙 GitHub:[github.com/mzeeshanwahid/next-safe-env]( Let me know what you think!","I got tired of Next.js runtime errors from missing environment variables, so I built next-safe-env (Open Source)",https://reddit.com/r/reactjs/comments/1t5bg0c/i_got_tired_of_nextjs_runtime_errors_from_missing/,0,7,26.0,26.0,11.9,0.0,35.0,-0.041,reactjs(1),"annoying, nightmare",7,0.8333,0.4291,0.0,0.5556,0.5,0.4696,47.6
106,1,1so5ggu,ChanX: An extension library for Django Channels that makes building realtime applications a breeze,"- ChanX: An extension library for Django Channels that makes building realtime applications a breeze

Best post body:
Hi everyone, I want to re-introduce my package ChanX, I always wished there was a package that could extend Django Channels to provide: Easier WebSocket (chat/data) handling without if-else hell Type safety that works with mypy and pyright to catch errors before writing tests or going live in production Auto-documentation with AsyncAPI-compatible docs autogenerated from code, similar to how drf-spectacular generates OpenAPI from DRF serializers Testing utilities that make testing flows predictable and correct Logging helpers, like django-structlog, to trace what was received and what was sent in a message handling flow Even a command line tool to generate code from the generated docs (e.g. for other microservices to use) And if you have ever used Django Channels to handle WebSocket/realtime messaging, I think you have likely run into these same problems: Inconsistent implementations between consumers: some use if-else, some use match-case, resulting in messy logic Painful code reviews, since you cannot tell when something will respond or what it accepts without carefully reading through the full code end to end Slow onboarding and slow integration with other teams (e.g. frontend) due to the lack of any documentation or API contract (AsyncAPI docs are very helpful here) Testing that is hard and unpredictable, since the default testing in Django Channels is based on timing or the first response, but sometimes we need more Difficulty tracing how and where the code runs So I built ChanX based on what I have done, faced, and wished I had for my last project. I am using it now and I love it. I built it with careful design and active maintenance, so I hope you find it useful and never have to face these problems again. Some use cases where ChanX works well: Realtime messaging (one-on-one or group chat with broadcasting and notifications) Realtime voice assistants (e.g. Deepgram, OpenAI) or chat assistants with streaming responses Any scenario that involves group messaging,",ChanX: An extension library for Django Channels that makes building realtime applications a breeze,https://reddit.com/r/django/comments/1so5ggu/chanx_an_extension_library_for_django_channels/,23,5,12.0,12.0,17.2,0.0,63.0,-0.088,django(1),painful,28,0.25,0.6948,0.0,1.0,0.5,1.0,47.6
35,1,1sz6gew,"Tech Leads: do you have an actual release checklist, or is it in your head like mine?","- Tech Leads: do you have an actual release checklist, or is it in your head like mine?

Best post body:
I've been promoted from Senior to Tech Lead for a while now, and there's one thing that's been a pain ever since. My release process runs almost entirely on memory and instinct. I don't have a release checklist at all. Our infra is pretty standard. Multiple services, multiple repos, a shared database, Jenkins for build and deploy. Most of the work is done manually: review PRs, merge code, click to build, run migration SQL scripts, deploy services in the right order. Every once in a while I forget to merge a dependent service. Or I miss a SQL script. I just deploy following my memory and hope things will be okay. If someone spots a problem in UAT or prod, I fix it, tell myself I won't make the same mistake again — only to forget something different next sprint. Here's what I think is happening: the ""release"" is really a checklist that lives entirely in my head. Which repos need merging, which services need deploying in which order, which scripts need running, what depends on what. None of it is in Jira, none of it is in our docs. It's reconstructed from memory every two weeks. What frustrates me most: the information exists. Jira knows what tickets changed. Git history knows which repos were touched. Migration files are sitting right there in the repo. The dependency between Service A and Service B is implicit in the code itself. All the data is there to assemble a deployment checklist every sprint — but I'm the human in the middle, and I'm bad at assembling it. So, genuine question for other Tech Leads. Have you been here? Do you have an actual written checklist, or do you pray on each release like I do? If you have one — is it generated from somewhere, or maintained by hand? And the part I'm most curious about: when you forget something, how do you find out?","Tech Leads: do you have an actual release checklist, or is it in your head like mine?",https://reddit.com/r/devops/comments/1sz6gew/tech_leads_do_you_have_an_actual_release/,5,31,24.0,24.0,19.2,0.0,27.0,0.096,devops(1),"manually, by hand",36,0.75,0.7451,0.0,0.4286,0.5,0.0,47.6
49,1,1t0vu9m,Help Django code stucks in the past,"- Help Django code stucks in the past

Best post body:
I am curently learning django but I have a problem. If I upgrade rewrite code the django code still behaves like if no changes were made. But when I restart my computer it works. Did anyone have this problem. Does anyone know how to fix it?",Help Django code stucks in the past,https://reddit.com/r/django/comments/1t0vu9m/help_django_code_stucks_in_the_past/,8,18,18.0,18.0,18.0,12.0,0.0,-0.25,django(1),"anyone know, does anyone",26,0.5,0.6801,0.4444,0.0,0.5,1.0,47.5
89,1,1sm23ml,"i hate managing twitter, linkedin, and a blog while coding. so i built an over-engineered voice memo app to do it for me.","- i hate managing twitter, linkedin, and a blog while coding. so i built an over-engineered voice memo app to do it for me.

Best post body:
honestly, context-switching between writing code and writing linkedin posts was killing my momentum. i'd have a decent idea while walking to get coffee, forget it by the time i sat down, and end up posting nothing. so i spent the last few months building a native iOS app to fix my own workflow. i can just ramble into my apple watch or phone (it handles live transcription in about 12 languages), and the 'ai second brain' chops that single voice note into 4 different tweet styles, a subreddit-specific post, and a markdown-formatted blog draft. most ai tools make you sound like a corporate robot, which i hate. to fix this, i added a tinder-style upvote/downvote system on the generated outputs. over time it analyzes what you pick and adjusts its system prompt to match your actual tone and length preferences. also, because normal analytics dashboards are boring, i made a 3D digital garden where your content actually grows. voice notes turn into water, text is grass, and your selected posts grow into trees that change with real-world seasons. totally unnecessary? yes. but it actually makes me want to log in. still trying to figure out the best way to handle the linkedin formatting, it's kinda finicky right now. curious if anyone else has tried replacing their marketing workflow entirely with voice notes? is my approach crazy? If you try and give me feedback, appreciate it : [MicMind](","i hate managing twitter, linkedin, and a blog while coding. so i built an over-engineered voice memo app to do it for me.",https://reddit.com/r/indiehackers/comments/1sm23ml/i_hate_managing_twitter_linkedin_and_a_blog_while/,34,126,14.0,14.0,31.1,0.0,48.0,0.083,indiehackers(1),hate,160,0.3333,1.0,0.0,0.7619,0.5,0.0,47.3
45,1,1t7rxkx,Built a Chrome extension that auto-generates React Query hooks from any real network request in DevTools,"- Built a Chrome extension that auto-generates React Query hooks from any real network request in DevTools

Best post body:
When building React apps, I kept doing this: 1. See an API call in DevTools 2. Manually write a useQuery or useMutation hook for it 3. Get the URL, headers, and body right by trial and error Built ReqConvert — it captures the live request and generates the complete React Query hook for you: \- useQuery for GET requests (with correct queryKey) \- useMutation for POST/PUT/DELETE (with onSuccess invalidation) \- Includes all headers automatically Also generates: cURL, fetch, Axios, Python, TypeScript, httpx, Postman Chrome Web Store (free to install): [ What's the most annoying part of wiring up API calls in your React projects?",Built a Chrome extension that auto-generates React Query hooks from any real network request in DevTools,https://reddit.com/r/reactjs/comments/1t7rxkx/built_a_chrome_extension_that_autogenerates_react/,0,7,22.0,22.0,7.9,0.0,55.0,-0.02,reactjs(1),"annoying, manually",7,0.6667,0.4291,0.0,0.873,0.5,0.2291,47.0
61,1,1sy0he6,Best modern way to handle transactional emails? (Struggling with Google Workspace/OAuth2),"- Best modern way to handle transactional emails? (Struggling with Google Workspace/OAuth2)

Best post body:
Hi everyone, I’m setting up a Django app and need to send standard transactional emails (account activation, password resets, etc.) from my custom domain. Currently, my domain email is hosted on Google Workspace. The roadblock: \- I've been trying to set this up using OAuth2, but I’m running into walls. Most of the tutorials I find are heavily outdated, or the API tokens I generate have a very short lifespan and are a nightmare to manage automatically. What I'm looking for: I’m not looking for anyone to write the code for me, just a push in the right direction or some updated documentation/resources. Specifically: \- Is there a modern, standard way to handle Google Workspace OAuth2 in Django without the token lifespan issues? \- Alternatively: I am completely open to using a transactional email service (like Resend, SendGrid, Mailgun, etc.) as long as the emails still come from my custom domain. What is the current industry standard or easiest reliable setup for Django in 2025/2026? Thanks in advance for any pointers!",Best modern way to handle transactional emails? (Struggling with Google Workspace/OAuth2),https://reddit.com/r/django/comments/1sy0he6/best_modern_way_to_handle_transactional_emails/,11,22,16.0,16.0,20.2,10.0,26.0,0.087,django(1),nightmare,33,0.4167,0.7276,0.3704,0.4127,0.5,0.0,46.1
44,1,1t6rw4d,Importance of SQL Data Analytics for Technical PM Roles,"- Importance of SQL Data Analytics for Technical PM Roles

Best post body:
I have been applying to many project management roles in the technical sphere, and noticed that for a lot of software PM roles, there are requirements to know SQL and how to query data and analyze data. I was wondering, how supplementary is it to have a basic understanding of SQL and Data analytics? Does anyone out there finds those skills to be useful? I imagine it would be significantly easier to do your job as a PM if you had direct access to user data.",Importance of SQL Data Analytics for Technical PM Roles,https://reddit.com/r/projectmanagement/comments/1t6rw4d/importance_of_sql_data_analytics_for_technical_pm/,2,17,22.0,22.0,17.6,0.0,36.0,0.17,projectmanagement(1),"excel, does anyone",19,0.6667,0.6181,0.0,0.5714,0.5,0.0,45.1
86,1,1swuhbf,Why is it super complicated to start a new React project these days?,"- Why is it super complicated to start a new React project these days?

Best post body:
I'm returning to React dev after taking a break for 4 years or so and wanted to start a hobby project. Hot damn, are things more complicated! ReactRouter used to be a routing solution that you'd simply install. Now it wants your entire project to sit on it's framework from the ground-up? People are talking a lot about TanStack, but I just want a router, I can do the rest myself. Why do I need to include the entire Tan ecosystem in my project? I'm not looking to build the next Google or YouTube, just looking to make a minimal GUI that I can run little light-weight SPAs on for a simple GUI, or load onto an ESP micro-controller to give it a web UI. I'm not looking for server-side anything. I'm not sure if I'm confused and missing something obvious that I can't quite see. What's an easy way to start a new React SPA project these days?",Why is it super complicated to start a new React project these days?,https://reddit.com/r/reactjs/comments/1swuhbf/why_is_it_super_complicated_to_start_a_new_react/,15,67,14.0,14.0,31.7,0.0,46.0,0.014,reactjs(1),hate,82,0.3333,0.9118,0.0,0.7302,0.5,0.0,45.0
39,1,1t6n6mv,Issue Tracker with simple submission form for non-tech users,"- Issue Tracker with simple submission form for non-tech users

Best post body:
There's a huge number of issue trackers out there. I've looked at a dozen or so, and most of them provide a highly complex, feature-rich dashboard that is appropriate for the helpdesk tech, but totally overwhelming to a non-tech user who just wants a simple form to log a request or issue. I'd like to find a tool, preferably open-source and self-hosted, that has an issue entry form appropriate for technology-averse users. The best I've been able to find so far is Bugzilla, but that could be my personal bias since I've used it off and on from its earliest incarnations. Even Bugzilla can be too much for some our most technophobe users. Any suggestions?",Issue Tracker with simple submission form for non-tech users,https://reddit.com/r/devops/comments/1t6n6mv/issue_tracker_with_simple_submission_form_for/,1,5,22.0,22.0,10.6,0.0,51.0,0.263,devops(1),"hate, any suggestions",6,0.6667,0.4015,0.0,0.8095,0.5,0.0,44.3
52,1,1t6cdy5,I rewrote my React drag-and-drop table library to handle 2D virtualization at 60fps,"- I rewrote my React drag-and-drop table library to handle 2D virtualization at 60fps

Best post body:
Hey r/reactjs, I just released v2.0 of react-table-dnd. I originally built this because trying to drag both rows and columns inside a fully virtualized grid is usually a nightmare—most libraries either cause massive layout thrashing or the drop zones completely break when virtual columns unmount. To fix this, I had to bypass React's render cycle almost entirely for the drag engine: O(1) updates: I ripped out React Context and moved to a vanilla store with useSyncExternalStore. Native cloning: Swapped React.cloneElement for native cloneNode(true). Direct DOM mutations: Drag movements happen outside React via style.transform in a requestAnimationFrame loop. O(1) Map caching: This tracks the DOM geometry. I put together a docs site with interactive demos, specifically showing off the 2D virtualized grid: Docs & Demos: [ Repo: [ What's Next (Future Plans) Fully Headless API: Moving toward a completely headless architecture. Since the drag logic and state are already decoupled from the UI, the goal is to provide raw hooks and primitives so you can bring your own markup.",I rewrote my React drag-and-drop table library to handle 2D virtualization at 60fps,https://reddit.com/r/reactjs/comments/1t6cdy5/i_rewrote_my_react_draganddrop_table_library_to/,16,1,16.0,16.0,12.2,0.0,46.0,-0.061,reactjs(1),nightmare,17,0.4167,0.5964,0.0,0.7302,0.5,0.6987,44.3
20,1,1syy1hg,"Indian sales teams are losing leads not because of bad salespeople, but bad systems","- Indian sales teams are losing leads not because of bad salespeople, but bad systems

Best post body:
Most sales teams I've worked with in India have the same problem: leads come in from 5 different places, WhatsApp messages go untracked, calls aren't recorded, and the founder is still doing follow-ups manually. The result? Hot leabsnds go cold simply because no one followed up on day 3. A few things that actually fixed this for teams I've seen: One centralized WhatsApp number for the business (not personal numbers) Auto-dialer so reps aren't manually punching numbers Call recordings so you can actually coach your team Lead tracking that doesn't live in someone's head or a random Excel sheet Id be Happy to share how we've set this up for a few Indian SMBs — or just answer questions if you're figuring this out yourself. (We build this at Salesmax — but genuinely open to just talking through the problem if you're facing it)","Indian sales teams are losing leads not because of bad salespeople, but bad systems",https://reddit.com/r/CRM/comments/1syy1hg/indian_sales_teams_are_losing_leads_not_because/,0,1,26.0,26.0,3.3,0.0,37.0,-0.066,CRM(1),"manually, excel",1,0.8333,0.143,0.0,0.5873,0.5,0.756,43.8
32,1,1t7hrmi,What thing do you think you've done wrong that's stopped or most limited your startup's success? What advice would you give earlier yourself in retrospect? i will not promote,"- What thing do you think you've done wrong that's stopped or most limited your startup's success? What advice would you give earlier yourself in retrospect? i will not promote

Best post body:
As the title says. For me - I'm an engineer and so I think I fall into a few common anti-patterns: \- I am prone to build first, validate after \- I like to build platforms and marketplaces ahead of demand Advice I'd give myself now: \- Validate the market. If no one is posting or confirming that your problem is a painful issue, take that as signal to pivot. \- Use your own product regularly. If you don't even use it and find it \very\ helpful - then why would your customers?",What thing do you think you've done wrong that's stopped or most limited your startup's success? What advice would you give earlier yourself in retrospect? i will not promote,https://reddit.com/r/startups/comments/1t7hrmi/what_thing_do_you_think_youve_done_wrong_thats/,8,23,24.0,24.0,22.4,0.0,11.0,0.073,startups(1),"painful, manually",31,0.75,0.7151,0.0,0.1746,0.5,0.0,43.2
22,1,1sojydl,CORS is not a security firewall (and why Access-Control-Allow-Origin: is about to break your Next.js app),"- CORS is not a security firewall (and why Access-Control-Allow-Origin: is about to break your Next.js app)

Best post body:
I see this happening constantly in modern App Router builds. A frontend dev gets a CORS error, panics, and throws Access-Control-Allow-Origin: \ in their next.config.js or Express middleware just to make the red console error go away. Here is the architectural reality in 2026: CORS is an insecurity feature. The browser's Same-Origin Policy (SOP) keeps you safe. CORS exists to intentionally drill a hole in that safety. If you use the \ wildcard while handling credentials (cookies/Auth headers), the browser will literally reject it per the MDN spec, but worse, if you start reflecting the Origin header dynamically to bypass this, you've just surrendered your API boundary to any malicious site. How to actually fix it: 1. Stop confusing CORS (Read protection) with CSRF (Write protection). 2. Offload the OPTIONS preflight to your API Gateway or Nginx if you can, or cache it with Access-Control-Max-Age so you don't double your mobile latency. 3. Hardcode your exact allowed origins in your environments. I got so tired of manually typing out the header arrays for Next.js and Express that I built a free, local-only visual builder that generates the exact config code so I don't have to look at MDN anymore. You can generate your configs here if you hate boilerplate: [ Or you can read the full architectural breakdown on why reflecting origins is a sin: [ Curious how you guys are handling preflights right now? Anyone just offloading it all to Cloudflare?",CORS is not a security firewall (and why Access-Control-Allow-Origin: is about to break your Next.js app),https://reddit.com/r/nextjs/comments/1sojydl/cors_is_not_a_security_firewall_and_why/,0,0,26.0,26.0,0.5,0.0,42.0,-0.081,nextjs(1),"hate, manually",0,0.8333,0.0,0.0,0.6667,0.5,0.9278,43.0
72,1,1s3dysp,What’s actually the best low-code / AI app builder for scaling?,"- What’s actually the best low-code / AI app builder for scaling?

Best post body:
I’ve been building apps with different AI and low-code tools lately, and I keep running into the same issue. A lot of them are great for MVPs, but once you think about real users, performance, or scaling, things start to break or feel limiting. I’m currently building my own app and testing different tools, and I’m trying to understand what actually holds up long-term. Which tools have you used that: \- can handle real users \- are flexible enough to grow \- don’t turn into a dead end after the MVP Looking for real experiences, not just generic recommendations.",What’s actually the best low-code / AI app builder for scaling?,https://reddit.com/r/lowcode/comments/1s3dysp/whats_actually_the_best_lowcode_ai_app_builder/,9,28,14.0,14.0,22.1,12.0,11.0,0.162,lowcode(1),recommendations,37,0.3333,0.7506,0.4444,0.1746,0.5,0.0,42.4
134,1,1sznt69,"Need database migration info, is there a claude prompt for this task.","- Need database migration info, is there a claude prompt for this task.

Best post body:
So I have a huge app build. Using nextjs and mongoose with mongodb. Has a lot of tables etc.. But now I am about to release to production and feels like it's gonna be a hustle to maintain it later. So planing to switch it to superbase (postgres). Plus, doing the migration manually will also be a lot of time. So like always. Is there any prompt to handle this task? Since it's a huge task I think things need to be precise. Please let me know if any of you know any thing about this.","Need database migration info, is there a claude prompt for this task.",https://reddit.com/r/nextjs/comments/1sznt69/need_database_migration_info_is_there_a_claude/,0,5,12.0,12.0,8.5,20.0,27.0,0.267,nextjs(1),manually,5,0.25,0.3697,0.7407,0.4286,0.5,0.0,42.4
