group_id,post_count,post_ids,rep_title,combined_text,sample_titles,top_url,total_upvotes,total_comments,avg_pain_score,max_pain_score,avg_engagement,avg_buying_intent,avg_buildability,avg_sentiment,top_subreddits,top_signals,total_engagement,pain_norm,eng_norm,intent_norm,build_norm,valid_norm,sent_norm,final_score
0,1,1sh5mqk,"OpenShots - Free, open-source alternative to TinyShots for screenshot beautification (Mac/Win/Linux)","- OpenShots - Free, open-source alternative to TinyShots for screenshot beautification (Mac/Win/Linux)

Best post body:
We just released OpenShots - a desktop app for capturing and beautifying screenshots. It's the open-source alternative to TinyShots (which is Mac-only and $29+). What it does: \- Capture full screen, region, or specific window (multi-monitor support) \- Add gradient/solid/image backgrounds \- Annotate with arrows, shapes, text, emoji (10-color pro palette, Inter font) \- Blur/cover sensitive areas with adjustable opacity \- Export PNG/JPEG/WebP at 1x/2x/3x with reusable presets \- One-click clipboard copy Tech stack: \- Tauri 2.x + Rust backend (under 20MB installer) \- React 19 + TypeScript + Konva.js \- Everything runs locally - zero network calls, zero telemetry Coming soon: \- CLI for batch processing and AI agent automation \- Background removal (on-device AI) \- Share directly from the app Download: [ GitHub: [ Happy to answer any questions!","OpenShots - Free, open-source alternative to TinyShots for screenshot beautification (Mac/Win/Linux)",https://reddit.com/r/indiehackers/comments/1sh5mqk/openshots_free_opensource_alternative_to/,34,72,64.0,64.0,28.7,40.0,63.0,0.208,indiehackers(1),"alternative to, switch from, excel",106,1.0,0.9642,1.0,1.0,0.5,0.0,86.8
12,1,1sxk64k,bot traffic is ruining my metrics and costing real money - anyone found a solution that works?,"- bot traffic is ruining my metrics and costing real money - anyone found a solution that works?

Best post body:
look at our logs from last month. 60% of API requests are automated. Not from our customers. аrom scrapers, AI agents, spam bots, you name it. we run a small saas. but these bots are hitting our endpoints, burning through our rate limits, skewing our analytics, and making it impossible to trust any of our usage data.we tried cloudflare waf. Helped a little. Tried ip reputation lists. Bots just rotate. Tried captchas on the frontend. Our users hate them and they barely stop the advanced bots anyway. Im burning hours every week just filtering noise.I know the real solution is some form of proof that the request is coming from a real human. but every time I bring up biometrics or device verification people get uncomfortable. And I get it. I dont want to store my users face scans in our db either. that feels like a breach waiting to happen.Huffman from Reddit said the quiet part out loud recently - platforms need personhood checks without capturing identity. Face ID as a baseline.Some hardware like [Orb]( processes everything on device, no cloud storage not saying im about to deploy iris scanners to our auth flow. But it made me realize this problem isnt niche anymore. Its infrastructure level now.what are you guys using that cuts down bot traffic without destroying user experience? Is there a middle ground im missing? or do we just accept that bots are part of life now and charge more for the extra compute? love to hear real world examples.",bot traffic is ruining my metrics and costing real money - anyone found a solution that works?,https://reddit.com/r/devops/comments/1sxk64k/bot_traffic_is_ruining_my_metrics_and_costing/,76,60,30.0,30.0,27.8,10.0,67.0,-0.037,devops(1),"hate, hours every",136,1.0,1.0,0.3704,1.0,0.5,0.4238,77.0
1,1,1s9q285,SuperCmd - Open-Source alternative to Raycast but does much more.,- SuperCmd - Open-Source alternative to Raycast but does much more.,SuperCmd - Open-Source alternative to Raycast but does much more.,https://reddit.com/r/indiehackers/comments/1s9q285/supercmd_opensource_alternative_to_raycast_but/,9,39,39.0,39.0,23.7,35.0,5.0,0.092,indiehackers(1),"alternative to, frustrated",48,1.0,0.803,1.0,0.0794,0.5,0.0,69.8
17,1,1t0dn3v,Need feedback on Two-stage ML approach for detecting and correcting mislabeled entity relationships (meters ↔ transformers),"- Need feedback on Two-stage ML approach for detecting and correcting mislabeled entity relationships (meters ↔ transformers)

Best post body:
Hey everyone, I am working on a real-world data quality problem and would appreciate feedback on my modeling approach. Context: I have a dataset of meters and their associated transformers (utility infrastructure). Some of these associations are incorrect, and the goal is to both detect and correct them. Training data: I’m using \20,000 manually reviewed meter–transformer associations: \- Correct association → label = 1 \- Incorrect association → label = 0 For incorrect cases, I also augment the data with the correct transformer, e.g.: Meter1 | Trans1 | 0 (incorrect) Meter1 | Trans2 | 1 (corrected) Meter2 | Trans3 | 1 (correct) Current baseline: I started with a logistic regression model (class\weight=""balanced"" due to \37% incorrect vs 63% correct). Using a 0.20 threshold gives strong true negative performance (\98%), but only moderate recall. Candidate generation: For inference, I generate candidate transformers within a 550 ft radius for each meter (including the currently assigned one): Meter1 | CandidateTrans1 | current Meter1 | CandidateTrans2 | candidate Meter1 | CandidateTrans3 | candidate Current idea: I’m considering splitting the problem into two stages: Model 1 — Detection Binary classification: Is the current meter → transformer association incorrect? Model 2 — Correction For meters flagged as incorrect, rank candidate transformers to recommend the most likely correct one. Pipeline: Raw data → Detection model → Flag suspicious cases → Candidate generation → Ranking model → Recommendation Features: \- Distance-based metrics (meter-to-transformer, centroid distances, etc.) \- Voltage correlation within meter clusters \- FLOC / naming similarity \- Cluster-level stats (group size, intra-cluster correlation) \- Relative features (distance rank, ratios, etc.) Questions: 1. Does this 2-stage decomposition (detection → correction) make sense vs a single end-to-end model? 2. For the correction step, would you frame this as classification or learning-to-rank? 3.",Need feedback on Two-stage ML approach for detecting and correcting mislabeled entity relationships (meters ↔ transformers),https://reddit.com/r/datascience/comments/1t0dn3v/need_feedback_on_twostage_ml_approach_for/,4,6,26.0,26.0,15.6,39.0,45.0,0.03,datascience(1),"manually, recommendations",10,0.8333,0.4948,1.0,0.7143,0.5,0.0,68.9
7,1,1t91h0b,I think dashboard fatigue is becoming a real problem,"- I think dashboard fatigue is becoming a real problem

Best post body:
The exhausting part of work, I have come to realise lately, is not even the work. It’s constantly flipping between dashboards, tabs, spreadsheets, Slack threads, analytics tools, ad managers, CRMs and random reports to answer one simple question. By the time I have it all pieced together I’m already mentally pooped. The funny thing is that most modern tools are supposed to help you be more productive, but sometimes it feels that they just create even more context switching and mental overload. I really believe that a lot of people are spending energy on fragmented workflows rather than making decisions. Do others feel this way or am I just spending too much time on the internet?",I think dashboard fatigue is becoming a real problem,https://reddit.com/r/analytics/comments/1t91h0b/i_think_dashboard_fatigue_is_becoming_a_real/,32,14,32.0,32.0,24.7,10.0,49.0,0.082,analytics(1),"too much time, spreadsheet",46,1.0,0.7944,0.3704,0.7778,0.5,0.0,67.5
24,1,1srn2e8,Anyone with Django 6 + Ninja,"- Anyone with Django 6 + Ninja

Best post body:
What do you think? What’s missing ORM you tried with it? Little background: Django 6, newer version, improved features like background tasks and security. Django Ninja, Fast API like framework uses Python type hints and Pydantic for data validation and serialization. It is faster, less complex alternative to the Django REST Framework (DRF)",Anyone with Django 6 + Ninja,https://reddit.com/r/django/comments/1srn2e8/anyone_with_django_6_ninja/,18,31,25.0,25.0,22.3,20.0,15.0,-0.131,django(1),alternative to,49,0.7917,0.8072,0.7407,0.2381,0.5,1.0,66.8
28,1,1t8btmh,"I built Orbit — an open-source modern VPS dashboard that combines metrics, logs, firewall, Docker and deploys in one Go binary","- I built Orbit — an open-source modern VPS dashboard that combines metrics, logs, firewall, Docker and deploys in one Go binary

Best post body:
Hey everyone, I was tired of juggling multiple tools to manage a VPS, so I started building Orbit. Goal: one binary install modern UI metrics logs firewall controls Docker management deployments Still early, looking for honest feedback from self-hosters. What would make you actually switch from your current setup? GitHub: [Orbit GitHub]()","I built Orbit — an open-source modern VPS dashboard that combines metrics, logs, firewall, Docker and deploys in one Go binary",https://reddit.com/r/devops/comments/1t8btmh/i_built_orbit_an_opensource_modern_vps_dashboard/,0,17,25.0,25.0,13.7,20.0,47.0,0.071,devops(1),switch from,17,0.7917,0.5964,0.7407,0.746,0.5,0.0,65.2
4,1,1t4o2e2,Media Compression in user's browser,"- Media Compression in user's browser

Best post body:
i want some suggestions on how to best optimize media compression on users browser for my webapp since my server cant handle compression as it is only of 1vcpu n 2gb ram. i am willing to put limit of only 30sec of video and compressing it to 480p through users browser. is it a good technique? or is there a better technique available since i am not willing to pay hundreds of bucks just to cloudflare stream and all",Media Compression in user's browser,https://reddit.com/r/devops/comments/1t4o2e2/media_compression_in_users_browser/,2,11,35.0,35.0,16.1,40.0,3.0,0.206,devops(1),willing to pay,13,1.0,0.5445,1.0,0.0476,0.5,0.0,64.1
2,1,1st2f6q,What Project Management tool are you using for your marketing agency?,"- What Project Management tool are you using for your marketing agency?

Best post body:
We currently use a very basic version of Wrike, I’m not in love with it and feel like we could use another tool to help manage our projects. For context, we get requests via email, we manually enter the project in Wrike with templates (updating the template with specific data based on their request), once in review we use another platform for comments and we send an email to the client with a link to review. It’s very clunky. Then, once we have completed the project the job is exported and shared with another system for invoicing. We manage around 100+ projects at any given time. There has to be a better way, potentially with an all in one system. Suggestions? Recommendations? Thank you in advance!",What Project Management tool are you using for your marketing agency?,https://reddit.com/r/projectmanagement/comments/1st2f6q/what_project_management_tool_are_you_using_for/,3,15,38.0,38.0,15.1,12.0,42.0,0.171,projectmanagement(1),"manually, recommendations, better way",18,1.0,0.6076,0.4444,0.6667,0.5,0.0,63.5
46,1,1t03ibi,Does anyone have experience with self-hosting gitlab runners,"- Does anyone have experience with self-hosting gitlab runners

Best post body:
So our small company is currently using the Gitlab shared runners for our CICD tests. So far its been fine but as we add more and more tests the time to run the tests keeps going up. We have parallelized the tests to keep the total run time down. But thats also burns more minutes. Last month we used up more than 32000 runner minutes. I was thinking of buying a mini-pc and just have that be a dedicated runner machine. It should run the tests faster since it has a local docker cache and the CPU is more powerful too. Just based on very minimal research I was thinking of something like [this]( If performs at par or better than the shared runner it should pay for itself in just 3 months. Is this a bad idea? Does anyone have experience with this kind of setup? Recommendations for which machines to use?",Does anyone have experience with self-hosting gitlab runners,https://reddit.com/r/devops/comments/1t03ibi/does_anyone_have_experience_with_selfhosting/,77,62,22.0,22.0,28.2,24.0,0.0,0.177,devops(1),"recommendations, does anyone",139,0.6667,1.0,0.8889,0.0,0.5,0.0,61.9
3,1,1t8u2op,Successful founders of technical infrastructure startups - what'd you build & how'd you determine demand for your product? How'd you 'win'? i will not promote,"- Successful founders of technical infrastructure startups - what'd you build & how'd you determine demand for your product? How'd you 'win'? i will not promote

Best post body:
As a technical founder, I've always felt drawn to technical products. My first startup was an AI coding assistant in 2019, but very few people were even willing to pay $20 for a developer tool - and the AI wasn't there yet to make it even 10% as powerful as it is today. Companies like braintrust seem really interesting and sorta simple - there's OSS alternatives for LLM observability, one could just host and whitelable something like a Langfuse. AI micro payments, virtual filesystems for multi-agents, cheap long-living always-available agent hosting - all seem like interesting ideas that sorta-maybe solve compelling problems. Buuuut I also feel like devs reach for OSS so readily that building a succesful business in the technical infra space is just incredibly difficult. How'd you validate your market? How'd you succeed when there are OSS alternatives to your product?",Successful founders of technical infrastructure startups - what'd you build & how'd you determine demand for your product? How'd you 'win'? i will not promote,https://reddit.com/r/startups/comments/1t8u2op/successful_founders_of_technical_infrastructure/,3,3,35.0,35.0,11.3,30.0,5.0,0.205,startups(1),willing to pay,6,1.0,0.4015,1.0,0.0794,0.5,0.0,61.7
21,1,1swc15p,Project reporting - how much is still manual?,"- Project reporting - how much is still manual?

Best post body:
I’m curious how other project managers and PMOs handle recurring reporting. In many organisations, the data already exists in tools like Excel, Jira, MS Project, Smartsheet, ServiceNow, Planview, Clarity, etc. But the final reports still often need to be manually prepared in Word, PowerPoint, or Excel for steering groups, sponsors, or leadership teams. For example: Weekly/monthly project status reports Risk and issue reports Change request packs Portfolio dashboards Benefits realisation reports A few questions: How much time do you or your PMO spend preparing recurring reports? Is most of the work data collection, formatting, narrative writing, or chasing updates? Do you use a standard template, or does every stakeholder want something different? Have you automated any of this successfully? Just trying to understand whether this is a real pain point across different PMO /project management environments or only specific to certain organisation.",Project reporting - how much is still manual?,https://reddit.com/r/projectmanagement/comments/1swc15p/project_reporting_how_much_is_still_manual/,23,39,26.0,26.0,23.9,0.0,76.0,0.134,projectmanagement(1),"manually, excel",62,0.8333,0.8549,0.0,1.0,0.5,0.0,60.4
27,1,1t5xb56,Did some people moved from SvelteKit and are happy with the change?,"- Did some people moved from SvelteKit and are happy with the change?

Best post body:
I am a Sveltekit lover, but I am planing to integrate some Shopify and Sanity to it in the future. As much as I love Sveltekit it’s clear that the React integration seems better with those. Did anyone made the switch from Sveltekit to NextJS? Are you happy with the move?",Did some people moved from SvelteKit and are happy with the change?,https://reddit.com/r/nextjs/comments/1t5xb56/did_some_people_moved_from_sveltekit_and_are/,4,5,25.0,25.0,14.6,20.0,35.0,0.24,nextjs(1),switch from,9,0.7917,0.4751,0.7407,0.5556,0.5,0.0,59.9
10,1,1shuyg4,what's a react pattern you mass-used then realized was overkill,"- what's a react pattern you mass-used then realized was overkill

Best post body:
i'll go first. useContext + useReducer for global state. i built an entire app with it because i didn't want to add redux and everyone on reddit said ""you don't need redux anymore, context is fine."" context is fine for themes and auth. context is not fine when you have 15 different slices of state and every update re-renders half your component tree. spent a weekend migrating to zustand and the app went from noticeable lag on every interaction to instant. the irony is zustand is like 20 lines to set up. i overcomplicated things by trying to avoid a dependency. my other one is wrapping everything in custom hooks. i went through a phase where every component had like 4 custom hooks because ""separation of concerns."" except now reading the component meant jumping between 5 files to understand what one page does. pulled most of them back inline and the code is way more readable. some hooks make sense. useAuth, useFetch, sure. useHandleSubmitButtonClickState does not need to exist. what pattern did you overuse before realizing simpler was better?",what's a react pattern you mass-used then realized was overkill,https://reddit.com/r/reactjs/comments/1shuyg4/whats_a_react_pattern_you_massused_then_realized/,269,111,30.0,30.0,42.6,0.0,28.0,0.137,reactjs(1),"hate, nightmare",380,1.0,1.0,0.0,0.4444,0.5,0.0,59.2
6,1,1t8c9el,Best tools for refundable pre-orders for Apps?,"- Best tools for refundable pre-orders for Apps?

Best post body:
I’m looking for a ""Kickstarter-style"" way to validate my app idea before I start coding. I have a prototype to demonstrate the concept, and now I want to see if people are willing to commit €20–€50 for a lifetime subscription. Since I’m based in Germany, trust is a massive hurdle. People here are generally skeptical of digital strangers. I need a tool that feels professional and offers a reliable refund option in case I don't hit my funding goal. I’ve looked at Stripe and Gumroad, but Stripe’s refund fees are a downside, and Gumroad isn't well-known here, which might kill conversion. Does anyone have experience with similar tools? I’m specifically looking for the best way to collect these commitments while ensuring users feel safe knowing they'll get their money back if the app never launches.",Best tools for refundable pre-orders for Apps?,https://reddit.com/r/smallbusiness/comments/1t8c9el/best_tools_for_refundable_preorders_for_apps/,1,3,33.0,33.0,9.6,22.0,8.0,0.223,smallbusiness(1),"need a tool, does anyone",4,1.0,0.3321,0.8148,0.127,0.5,0.0,57.3
26,1,1srxdln,A better alternative to Swipe Buttons,"- A better alternative to Swipe Buttons

Best post body:
Hey everyone, I originally built this swipe button for our own business app because we wanted something that felt smooth, simple, and reliable for real actions, not just a basic style swipe control. It’s been part of our organization's actual use case, and after using it ourselves, I thought it’d be nice to share it with everyone in case it helps someone else too. It supports custom styling, progress callbacks, configurable success threshold, and optional bounce-back animation. Package: [ It was made for our own workflow first, but it’s customizable enough to fit a lot of other apps too. Would genuinely love feedback from React Native devs on the feel and API. [](",A better alternative to Swipe Buttons,https://reddit.com/r/reactjs/comments/1srxdln/a_better_alternative_to_swipe_buttons/,4,2,25.0,25.0,10.1,20.0,30.0,0.226,reactjs(1),alternative to,6,0.7917,0.4015,0.7407,0.4762,0.5,0.0,57.3
25,1,1sp84k9,"The 2026 ""Editorial UI"" Stack: Shadcn Sera, Next.js 15.3, and more","- The 2026 ""Editorial UI"" Stack: Shadcn Sera, Next.js 15.3, and more

Best post body:
Hey everyone, I’ve been tracking the shift toward ""Editorial UI"" over the last few days—basically using print design principles (heavy serifs, uppercase tracking) for web apps. It's a great look for luxury brands and portfolios, but can be tricky for performance. I've curated 8 tools that solve this, including the new Shadcn Sera style and the official Turbopack stability update in Next.js 15.3. Shadcn Sera: The fastest way to get this look. Next.js 15.3: Massive speed gains for local dev. Park UI: A solid alternative to Radix-based libraries. Full technical collection here: What are your thoughts on the Serif vs Sans-Serif debate for SaaS in 2026?","The 2026 ""Editorial UI"" Stack: Shadcn Sera, Next.js 15.3, and more",https://reddit.com/r/nextjs/comments/1sp84k9/the_2026_editorial_ui_stack_shadcn_sera_nextjs/,7,3,25.0,25.0,12.7,20.0,21.0,0.126,nextjs(1),alternative to,10,0.7917,0.4948,0.7407,0.3333,0.5,0.0,57.0
13,1,1t7io7h,Still tracking clients in a spreadsheet? I’d love your feedback.,"- Still tracking clients in a spreadsheet? I’d love your feedback.

Best post body:
If you are using a spreadsheet to track clients, leads, follow-ups, notes, or opportunities, I’d love to talk to you. Most CRMs feel way too complicated for solopreneurs and early-stage teams. They ask you to set up pipelines, fields, views, automations, dashboards, and workflows before you get much value. But the actual job is usually simpler: Remember who you talked to. Know what happened. Know who needs a follow-up. Find the right context when you need it. We’re building Finder, an AI-powered CRM for people who want the usefulness of a CRM without turning it into another project. The goal is to make it easier to manage customer relationships as they actually happen, through contacts, companies, notes, follow-ups, and plain-language search. For example, you should be able to ask: “Who do I need to follow up with this week?” “Which clients mentioned pricing?” “Show me everyone I spoke with last month.” “Find companies interested in a proposal.” “Add Sarah from Acme and remind me to follow up Friday.” We’re looking for early users who are currently managing client relationships manually and want something lighter than the usual CRM options. For now, it’s early access. We’re offering high-touch support, direct founder access, and the chance to shape what gets built next. This is not a thin AI wrapper or a quick prototype. We’re building a real CRM product, but starting with the people who feel the pain most clearly. I’d love feedback: What are you using today to keep track of clients? Where does your current process break down? What would make a CRM feel useful instead of burdensome? Would you be open to trying it and giving direct feedback?",Still tracking clients in a spreadsheet? I’d love your feedback.,https://reddit.com/r/CRM/comments/1t7io7h/still_tracking_clients_in_a_spreadsheet_id_love/,0,10,28.0,28.0,10.8,0.0,106.0,0.074,CRM(1),"manually, spreadsheet",10,0.9167,0.4948,0.0,1.0,0.5,0.0,55.3
29,1,1t8dt3g,API Alternative to Gemini Model,"- API Alternative to Gemini Model

Best post body:
I have been using Google gemini 2.5 flash API(free tier) for my side projects, I have had really bad experiences, but I really want a good alternative to this which can atleast work. I've heard about deepseek v4 like it's really got very good, and they offer 1 month I guess 5M token cap trial, but then it's post paid, but it's kinda cheap, cheaper than other models I would say. Do you guys have other better alternative.",API Alternative to Gemini Model,https://reddit.com/r/nextjs/comments/1t8dt3g/api_alternative_to_gemini_model/,0,5,25.0,25.0,5.4,20.0,20.0,0.164,nextjs(1),alternative to,5,0.7917,0.3697,0.7407,0.3175,0.5,0.0,54.3
